政策新闻标题,新闻内容
广西：关于2021年普通高校招生高职高专提前批征集志愿的说明,"一、征集志愿范围高职高专提前批招生计划未完成的院校,包括艺术类、体育类和其他类。二、征集志愿对象所有符合条件且未被录取，并有相应科类考试成绩或相应面试合格成绩的考生均可填报本次征集志愿，本次征集志愿不受文化录取最低控制分数线限制。三、填报征集志愿截止时间本次填报截止时间为2021年8月9日9:00。四、征集志愿设置高职高专提前批其他类实行单志愿，即设1个院校志愿，6个专业志愿和1个“是否服从校内专业调剂”选项。高职高专提前批艺术类和体育类实行平行志愿，即设10个院校志愿，每个院校设6个专业志愿和1个“是否服从院校内专业调剂”选项。在“是否服从院校内专业调剂”选项中，考生可以选择“服从院校内所有专业调剂”或“不服从院校内专业调剂”，填报区内院校的考生还可以选择“服从院校内部分专业调剂”。五、征集志愿投档规则本次征集志愿投档规则、录取模式不变。征集志愿填报结束后，高职高专提前批艺术类、体育类、其他类实行并行投档，即在同一时段进行投档,在同一时间考生只能被投档到其中一类（例如：征集志愿其他类投档后，填报了该批次的考生的档案状态显示为“已投至XX院校，院校阅档中”，此时艺术类与体育类也进行投档，则处于其他类“已投至XX院校，院校阅档中”状态的考生即使填报了体育类或艺术类志愿，也无法投档到体育类或艺术类），考生填报时应慎重选择。档案状态处于“考生档案目前未投出”的考生档案可参与排序投档，档案状态处于“已投至XX院校，院校阅档中”或“已被XX院校录取”的考生档案将不会被投出。征集志愿投档前，各院校文化录取最低控制分数线上的生源仍不足的，经院校申请、自治区招生考试院批准，可以适当降低文化分数线（艺术统考分数和体育高考分数要求不变）投档、录取，降分幅度将根据学校申请、考生志愿和缺额数量等情况综合研究确定。投档录取时，双上线（文化录取最低控制分数线和艺术统考/体育高考录取最低控制分数线上）考生优先投档录取。六、其他本次征集志愿的计划专业信息，在“广西招生考试院”网站的“通知公告”和“普通高考—通知公告、招生信息”栏目公布。除“备注”栏特别说明以外，其他信息（院校代码、专业代码、专业名称、科类、学制、学费等）与自治区招生考试院组编的《2021年高考指南招生计划篇》公布的信息相同。"
福建：2021年高招录取常见问题解答（4）,"1.考试院已发布普通类本科批常规志愿各院校专业组投档最低分，预计7月30日晚上对外公布录取结果，考生凭帐号密码登录查询会有几种查询结果？答：共有2种查询结果。第1种，考生已经被录取，系统显示：第2种，考生未被任何院校录取，系统显示：如果考生未被任何院校录取，请及时填报普通类本科批征求志愿。2.普通类本科批常规志愿未被录取的考生，还有上本科的机会吗？答：有。普通类本科批常规志愿未被录取的考生可于7月31日填报第一次征求志愿，仍未被录取的考生8月5日还可填报第二次征求志愿。3.普通类本科批，考生分数与某院校专业组投档分相同，为什么未被投档？答：假设A高校999专业组计划录取100名考生。投档时，网上录取系统从高分到低分按位次投放100名填报A高校999专业组的考生给A高校，第100名考生的高考成绩就是A高校999专业的投档最低分。虽然第101名考生与第100名考生同分，但第101名考生的位次低于第100名考生，因此第101名考生就不能被投档。4.征求志愿时部分高校仍有缺额计划，为什么有些考生报考了该校却没有被录取?答：造成这种情况的原因，主要是一些考生在常规志愿阶段已经投档到高校，但达不到所报专业的录取要求，有的考生不服从专业调剂，高校只好做退档处理，从而产生了缺额计划。5.考生什么时候能收到大学录取通知书？答：考生的录取通知书由招生院校寄发，具体情况请咨询录取院校招生办公室。6.填报普通类高职（专科）批常规志愿有什么方法？答：普通类高职（专科）常规志愿可填报40个平行且有顺序的专业志愿。一般有2种填报方式：（1）考生喜欢A院校，可将A院校的所有专业按照自己喜欢的顺序进行排序，把最喜欢的专业填在第一个志愿，第二喜欢的专业填在第二个志愿，第三喜欢的专业填在第三个志愿……，以此类推，填满A院校所有专业志愿。如果考生分数较低，建议填报部分民办院校专业,提高录取机会。（2）考生如果喜欢某个专业，如“计算机网络技术”，就可以把招生计划本中所有院校的“计算机网络技术”进行排序，按照自己喜欢的顺序进行填报。如果考生分数较低，建议填报部分民办院校“计算机网络技术”专业，提高录取机会。考生如果有多个喜欢的专业方向，也可以把以上2种方式进行组合填报。7.高职（专科）批录取存在专业调剂吗？答：不存在。高职（专科）批实行专业平行志愿投档模式，考生填报的是平行且有顺序排列的专业志愿，不存在专业调剂情况。8.高职（专科）批填报志愿投档后会被退档吗？答：有可能。高职（专科）批实行专业平行志愿投档模式，每个考生只有一次投档机会。最大的风险是进档后因专业受限被院校退档。因此，考生必须了解以下两个方面：一是自己的高考体检结论，是否有色盲、色弱、纹身、身高等专业录取要求，并认真阅读《普通高等学校招生体检工作指导意见》（可查阅《福建省2021年高考志愿填报指南》）。二是查阅准备填报的院校招生章程，如是否有单科成绩等方面的要求，避免进档后因专业受限被退档。9.什么时候可以查询普通类高职（专科）批常规志愿的录取结果？答：普通类高职（专科）批常规志愿录取结果预计于8月14日晚上。考生可以凭自己的账号密码登录省教育考试院官网查询录取结果。具体以省教育考试院官网公布的信息为准。"
安徽：2021年普通高校招生文理科志愿设置及投档办法,一、文理科录取分本科提前批、高职（专科）提前批、本科第一批、本科第二批、高职（专科）批，共5个批次。（一）本科志愿本科提前批分为军事、公安司法和应急消防（含公安司法国家专项计划）、公费师范、优师定向、免费医学定向和其他共6类。军事、公费师范、优师定向和免费医学定向类实行平行志愿，设置A、B、C、D、E、F六所院校平行志愿及院校服从志愿（免费医学定向不设院校服从和专业服从志愿），每所院校设6个专业志愿及专业服从志愿。该批次公安司法和应急消防（含公安司法国家专项计划）、其他类设1个院校志愿，每所院校设6个专业及专业服从志愿。考生的本科提前批次志愿只可在上述6类中选报一类。本科提前批后还单设若干特殊类型招生录取批次，依次分别为国家专项计划、地方专项计划、高校专项计划。本科第一批平行志愿包含A、B、C、D、E、F六所院校；本科第二批的平行志愿包含A、B、C、D、E、F、G、H、I、J十所院校。本科第一、二批的每所院校设6个专业志愿及专业服从志愿。（二）高职（专科）志愿高职（专科）提前批分为定向培养士官、免费医学定向、公安司法和其他共4类，定向培养士官、免费医学定向实行平行志愿，设置A、B、C、D、E、F六所院校，每所院校设6个专业志愿（定向培养士官设专业服从，免费医学定向不设专业服从）；公安司法和其他类设1个院校志愿，6个专业及专业服从志愿。考生的高职提前批次志愿只可选报一类。高职（专科）批平行志愿包含A、B、C、D、E、F六所院校，每所院校设6个专业志愿及专业服从志愿。（三）征集志愿各批次平行志愿录取结束后，对未完成的计划及院校追加的计划，面向批次线上未录取考生征集志愿；同时，批次线下20分以内的考生也可以据此计划填报降分征集志愿，作为批次线上未完成招生计划院校降分投档的备档。征集志愿和降分征集志愿均包含A、B、C、D、E、F、G、H八所院校志愿（其中高职批设院校服从志愿），每所院校设6个专业志愿及专业服从志愿。填报军校、公安司法和应急消防（含公安司法国家专项计划）征集志愿的考生，须在军校、公安司法和应急消防体检、面试、政治考察等合格名单内。征集志愿录取结束后，仍未完成计划的院校及专业按考生填报的降分征集志愿进行逐分降分投档。二、文理科特殊类招生的志愿设置：高校专项计划设1个院校志愿，6个专业志愿及专业服从志愿；国家专项计划、地方专项计划分别设A、B、C、D、E、F六所院校平行志愿，每所院校设6个专业志愿及专业服从志愿；非西藏生源定向西藏就业计划设1个院校志愿及1个专业志愿。高水平运动队、高水平艺术团的考生须将院校志愿填在合格院校所在批次的A志愿位置。三、文史、理工类平行志愿投档原则“平行志愿”投档原则为“分数优先，遵循志愿”。首先对进档考生按总分从高到低排序，再依次按考生志愿院校顺序逐个检索投档。平行志愿第一轮投档录取结束后，如果仍有学校缺额和符合投档条件的考生，省考试院可根据实际情况进行多轮次投档。每一轮投档不更改上一轮录取结果。四、文史、理工类投档程序及办法（一）非平行志愿投档本科提前批次、高职（专科）提前批次公安司法和应急消防及其他类等非平行志愿录取院校，调档比例原则上控制在120%以内。如投档考生不满足招生院校章程要求（如身高、视力、专业不服从等）被退档，则按照从高分到低分的顺序补充投档。（二）平行志愿投档1.模拟投档：每轮次正式投档前，省考试院按既定投档比例进行模拟投档。高校通过网上录取信息交互平台了解本校的模拟投档及生源情况，并据此决定是否增加招生计划，并及时向省考试院反馈意见，调整投档比例和计划，形成招生院校的投档线（投档考生名次）。2.确定投档比例：按照平行志愿投档的批次，高校根据模拟投档情况在正式投档前完成计划调整，调档比例原则上控制在105%以内（省属院校原则上按100%的比例），并确保符合录取规则的调档考生能够录取。3.正式投档：根据高校最终确定的招生计划及调档比例，首先对考生按总分（含政策加分）从高到低排序，再逐个对考生志愿从A院校到F（J）院校的顺序进行检索，被检索的志愿中一旦出现符合投档条件的院校，即向该院校投档。为充分尊重考生志愿，进一步提高考生志愿满足率，如普通文理科的平行志愿第一轮投档录取结束后，仍有学校缺额和符合投档条件的考生，可视情进行多轮次投档。考生总分（含政策加分）相同时，则按统考科目成绩总分排序，统考科目成绩总分仍相同时，则按单科顺序及分数从高到低排序投档，单科顺序：理科为理科综合、数学、语文、外语；文科为文科综合、语文、数学、外语。同一学校并列名次全部投档。（三）征集志愿投档： 征集志愿投档比例确定为相应计划的100%，投档办法与相应批次投档办法相同。（四）降分投档：1.一般性降分：征集志愿录取结束后，对仍未完成计划的院校及专业，经招生院校同意，按考生填报的降分征集志愿降分进行投档。最大降分幅度为20分。2.政策性降分：非西藏生源定向西藏就业计划，可在本科相应批次各有关高校投档分数线下40分内降分投档。3.定向就业招生，在学校调档线上不能完成招生计划的，可在学校调档线下20分以内、同批次控制分数线以上，对考生平行志愿逐校逐专业逐分检索投档（不含专业服从）。经降分仍未完成的计划，则就地转为非定向计划执行。降分投档比例确定为相应计划的100%。（五）特殊类型招生投档：1.民族院校按其招收少数民族和汉族考生类别，招生计划单列，分别进行投档。2.高水平运动队、高水平艺术团按照院校报送的测试合格名单，于招生院校所在批次平行志愿投档前单独投档录取。非西藏生源定向西藏就业计划按考生志愿于相应批次平行志愿投档录取结束后单独投档录取。3.本科提前批特殊类型的投档次序为国家专项计划、地方专项计划、高校专项计划。（六）本、专科提前批院校投档执行相应的本科一批、二批或高职（专科）批次的录取最低控制分数线。
河南：一图看懂考生电子档案状态,一、文理科录取分本科提前批、高职（专科）提前批、本科第一批、本科第二批、高职（专科）批，共5个批次。（一）本科志愿本科提前批分为军事、公安司法和应急消防（含公安司法国家专项计划）、公费师范、优师定向、免费医学定向和其他共6类。军事、公费师范、优师定向和免费医学定向类实行平行志愿，设置A、B、C、D、E、F六所院校平行志愿及院校服从志愿（免费医学定向不设院校服从和专业服从志愿），每所院校设6个专业志愿及专业服从志愿。该批次公安司法和应急消防（含公安司法国家专项计划）、其他类设1个院校志愿，每所院校设6个专业及专业服从志愿。考生的本科提前批次志愿只可在上述6类中选报一类。本科提前批后还单设若干特殊类型招生录取批次，依次分别为国家专项计划、地方专项计划、高校专项计划。本科第一批平行志愿包含A、B、C、D、E、F六所院校；本科第二批的平行志愿包含A、B、C、D、E、F、G、H、I、J十所院校。本科第一、二批的每所院校设6个专业志愿及专业服从志愿。（二）高职（专科）志愿高职（专科）提前批分为定向培养士官、免费医学定向、公安司法和其他共4类，定向培养士官、免费医学定向实行平行志愿，设置A、B、C、D、E、F六所院校，每所院校设6个专业志愿（定向培养士官设专业服从，免费医学定向不设专业服从）；公安司法和其他类设1个院校志愿，6个专业及专业服从志愿。考生的高职提前批次志愿只可选报一类。高职（专科）批平行志愿包含A、B、C、D、E、F六所院校，每所院校设6个专业志愿及专业服从志愿。（三）征集志愿各批次平行志愿录取结束后，对未完成的计划及院校追加的计划，面向批次线上未录取考生征集志愿；同时，批次线下20分以内的考生也可以据此计划填报降分征集志愿，作为批次线上未完成招生计划院校降分投档的备档。征集志愿和降分征集志愿均包含A、B、C、D、E、F、G、H八所院校志愿（其中高职批设院校服从志愿），每所院校设6个专业志愿及专业服从志愿。填报军校、公安司法和应急消防（含公安司法国家专项计划）征集志愿的考生，须在军校、公安司法和应急消防体检、面试、政治考察等合格名单内。征集志愿录取结束后，仍未完成计划的院校及专业按考生填报的降分征集志愿进行逐分降分投档。二、文理科特殊类招生的志愿设置：高校专项计划设1个院校志愿，6个专业志愿及专业服从志愿；国家专项计划、地方专项计划分别设A、B、C、D、E、F六所院校平行志愿，每所院校设6个专业志愿及专业服从志愿；非西藏生源定向西藏就业计划设1个院校志愿及1个专业志愿。高水平运动队、高水平艺术团的考生须将院校志愿填在合格院校所在批次的A志愿位置。三、文史、理工类平行志愿投档原则“平行志愿”投档原则为“分数优先，遵循志愿”。首先对进档考生按总分从高到低排序，再依次按考生志愿院校顺序逐个检索投档。平行志愿第一轮投档录取结束后，如果仍有学校缺额和符合投档条件的考生，省考试院可根据实际情况进行多轮次投档。每一轮投档不更改上一轮录取结果。四、文史、理工类投档程序及办法（一）非平行志愿投档本科提前批次、高职（专科）提前批次公安司法和应急消防及其他类等非平行志愿录取院校，调档比例原则上控制在120%以内。如投档考生不满足招生院校章程要求（如身高、视力、专业不服从等）被退档，则按照从高分到低分的顺序补充投档。（二）平行志愿投档1.模拟投档：每轮次正式投档前，省考试院按既定投档比例进行模拟投档。高校通过网上录取信息交互平台了解本校的模拟投档及生源情况，并据此决定是否增加招生计划，并及时向省考试院反馈意见，调整投档比例和计划，形成招生院校的投档线（投档考生名次）。2.确定投档比例：按照平行志愿投档的批次，高校根据模拟投档情况在正式投档前完成计划调整，调档比例原则上控制在105%以内（省属院校原则上按100%的比例），并确保符合录取规则的调档考生能够录取。3.正式投档：根据高校最终确定的招生计划及调档比例，首先对考生按总分（含政策加分）从高到低排序，再逐个对考生志愿从A院校到F（J）院校的顺序进行检索，被检索的志愿中一旦出现符合投档条件的院校，即向该院校投档。为充分尊重考生志愿，进一步提高考生志愿满足率，如普通文理科的平行志愿第一轮投档录取结束后，仍有学校缺额和符合投档条件的考生，可视情进行多轮次投档。考生总分（含政策加分）相同时，则按统考科目成绩总分排序，统考科目成绩总分仍相同时，则按单科顺序及分数从高到低排序投档，单科顺序：理科为理科综合、数学、语文、外语；文科为文科综合、语文、数学、外语。同一学校并列名次全部投档。（三）征集志愿投档： 征集志愿投档比例确定为相应计划的100%，投档办法与相应批次投档办法相同。（四）降分投档：1.一般性降分：征集志愿录取结束后，对仍未完成计划的院校及专业，经招生院校同意，按考生填报的降分征集志愿降分进行投档。最大降分幅度为20分。2.政策性降分：非西藏生源定向西藏就业计划，可在本科相应批次各有关高校投档分数线下40分内降分投档。3.定向就业招生，在学校调档线上不能完成招生计划的，可在学校调档线下20分以内、同批次控制分数线以上，对考生平行志愿逐校逐专业逐分检索投档（不含专业服从）。经降分仍未完成的计划，则就地转为非定向计划执行。降分投档比例确定为相应计划的100%。（五）特殊类型招生投档：1.民族院校按其招收少数民族和汉族考生类别，招生计划单列，分别进行投档。2.高水平运动队、高水平艺术团按照院校报送的测试合格名单，于招生院校所在批次平行志愿投档前单独投档录取。非西藏生源定向西藏就业计划按考生志愿于相应批次平行志愿投档录取结束后单独投档录取。3.本科提前批特殊类型的投档次序为国家专项计划、地方专项计划、高校专项计划。（六）本、专科提前批院校投档执行相应的本科一批、二批或高职（专科）批次的录取最低控制分数线。
浙江：普通类提前招生一段录取结果15日可查询！你填报的传统志愿这样投档,2021年我省高考录取正在进行，普通类提前招生一段录取结果在7月15日左右可以查询。三段改为两段后，普通类提前招生按新一段线、新二段线分段，再根据院校志愿顺序依次进行。那么，你所填报的普通类提前招生传统志愿，是怎样投档录取呢？传统志愿，是指同一录取段（批）次设置的有先后顺序的院校志愿。传统志愿按“志愿优先”规则，首先考虑第一志愿的上线考生，生源不够时才会投档第二志愿的考生，依此类推，也就是每个院校志愿各排各的队，根据事先公布的比例（一般不超过1:1.2）从高分到低分投档。我省普通类提前招生，包括有政审、面试、体检等特殊要求的军事、公安、定向招生、三位一体综合评价招生、定向培养士官试点以及航海类等院校和专业。设置5个院校志愿，每个院校不超过6个专业志愿和专业服从志愿。在分段投档后，由各院校审阅考生电子档案，并按事先公布的招生规则确定录取名单及专业，省教育考试院进行录检审核。高校根据审核盖章后的录取新生名册寄发新生录取通知书。
